{
  "schema_version": "model-profile.v1",
  "id": "kimi-k2-hf-novita",
  "version": "1.0.0",
  "adapter_kind": "openai_compatible",
  "provider": "huggingface-novita",
  "model": "moonshotai/Kimi-K2-Instruct:novita",
  "checkpoint": null,
  "chat_url": "https://router.huggingface.co/v1/chat/completions",
  "secret_ref": "HF_TOKEN",
  "capabilities": ["text_generation"],
  "context_window_tokens": 131072,
  "max_input_utf8_bytes": 32768,
  "max_output_tokens": 4096,
  "structured_output": "plain_json",
  "supported_parameters": ["max_tokens", "temperature"],
  "request_options": {"temperature": 0.6},
  "probe": {
    "mode": "health",
    "url": "https://router.huggingface.co/v1/models",
    "timeout_seconds": 5,
    "success_ttl_seconds": 300
  }
}
